<?xml version="1.0" encoding="UTF-8"?>
<!DOCTYPE catalogo SYSTEM "11.dtd">

<catalogo xmlns:xsi="http://www.w3.org/2001/XMLSchema-instance" xsi:noNamespaceSchemaLocation="11.xsd">
    <portatil>
        <referencia>AJ87898</referencia>
        <nombre>15-DA0204NS</nombre>
        <fabricante nombre="HP"/>
        <procesador>
            <nombre>I3-7020U</nombre>
            <cache tamanyo="GB">2</cache>
            <numero>1</numero>
            <velocidad medida="Ghz">2.3</velocidad>
        </procesador>
        <ram>
            <memoria unidadMedida="GB">8</memoria>
            <tipo>DDR4</tipo>
        </ram>
        <disco tipoDisco="SSD">
            <capacidad unidadMedidaDisco="GB">256</capacidad>
        </disco>
        <pantalla>
            <dimension tamanyoPantalla="pulgadas">15</dimension>
            <resolucion>1366x768</resolucion>
            <resolucionMax>1980x1080</resolucionMax>
        </pantalla>
        <grafica>
            Integrada
        </grafica>
        <foto>
            portatil1.png
        </foto>
    </portatil>
    <portatil>
        <referencia>DK65208</referencia>
        <nombre>IDEAPAD S145</nombre>
        <fabricante nombre="LENOVO"/>
        <procesador>
            <nombre>I3-8145U</nombre>
            <cache tamanyo="GB">1</cache>
            <numero>1</numero>
            <velocidad medida="Ghz">2.1</velocidad>
        </procesador>
        <ram>
            <memoria unidadMedida="GB">8</memoria>
            <tipo>DDR4</tipo>
        </ram>
        <disco tipoDisco="SSD">
            <capacidad unidadMedidaDisco="GB">256</capacidad>
        </disco>
        <pantalla>
            <dimension tamanyoPantalla="pulgadas">14</dimension>
            <resolucion>1980x1080</resolucion>
            <resolucionMax>1980x1080</resolucionMax>
        </pantalla>
        <grafica>
            Integrada
        </grafica>
        <foto>
            portatil2.png
        </foto>
    </portatil>
</catalogo>